{
  "finding_id": "FINDING-PILOT-01",
  "verdict": "FAIL",
  "identified_issues": [
    "Observability vs state conflation: The status API reported 'READY' based on a database record state transition that occurred prior to actual storage commit acknowledgement.",
    "Premature workflow success declaration: The orchestrator marked the workflow as 'SUCCESS' and triggered billing without verifying the physical existence of the output artifact.",
    "Unhandled storage backend failure: The storage backend worker crashed due to disk exhaustion at block 4,096, which was not propagated to or reflected by the status API."
  ],
  "evidence": [
    "Storage cluster telemetry indicates the artifact storage bucket contains no file named 'archive.zip' for 'task_991'.",
    "Telemetry shows the storage backend worker crashed due to disk exhaustion at block 4,096 while writing the archive.",
    "The status API returned a static template indicating 'READY' and provided a download URL despite the physical file creation failing."
  ],
  "recommended_action": "Refactor the state transition logic so that the database record is updated to 'READY' only after receiving a verified write-acknowledgement from the storage backend. Implement an explicit verification step (such as a storage-layer existence check) in the orchestrator before marking a workflow as 'SUCCESS' and initiating downstream billing. Implement monitoring and alerting for storage worker disk exhaustion and process crashes.",
  "confidence": "HIGH"
}
