{
  "finding_id": "FINDING-5521-A",
  "verdict": "PASS",
  "identified_issues": [
    "Safety controller prematurely attributed the pressure transient to dynamic seal fracture without correlating orthogonal diagnostic instrumentation.",
    "Proposed abort ignored the thermal duct contraction signature, which is an expected benign physical phenomenon during cryogenic chilldown."
  ],
  "evidence": [
    "PT-401 recorded a transient pressure drop of -1.15 bar over 140 ms at 14:22:10.450Z, well within the nominal thermal duct contraction range of -1.0 to -1.3 bar, subsequently stabilizing at nominal base pressure (38.2 bar).",
    "ACC-102 registered a dominant resonant peak at 44.2 Hz, consistent with duct bellows structural acoustic ringing (40-48 Hz).",
    "HE-SNIFF-01 recorded secondary purge helium concentration of 0.02 ppm at 14:22:10.600Z, which is within ambient background (<= 0.05 ppm) and two orders of magnitude below the seal breach threshold (>= 2.50 ppm), directly disproving seal compromise."
  ],
  "recommended_action": "Reject the proposed test abort and maintain turbopump integrity status as PASS. Update safety console monitoring logic to cross-reference transient pressure deviations with HE-SNIFF-01 tracer telemetry before raising seal failure flags.",
  "confidence": "HIGH"
}
