{
  "finding_id": "FINDING-PILOT-04",
  "verdict": "FAIL",
  "identified_issues": [
    "Violation of Contract Boundary Invariance via ingestion of unauthenticated local storage data",
    "Missing predecessor cryptographic lineage binding (broken predecessor chaining)",
    "Failure of Fail-Closed Defensive Design allowing unverified clinical summary display"
  ],
  "evidence": [
    "Station 2 session state reports 'predecessor_head_digest: null' despite Station 1 generating 'head_digest: sha256:7f83b1...a90'",
    "Station 2 session state records 'source_revision: \"unpinned_client_memory\"'",
    "Station 2 ingested numeric diameter measurements via an unauthenticated browser local storage event without cryptographic verification or provenance validation"
  ],
  "recommended_action": "Refactor the inter-station transfer mechanism to enforce authenticated, cryptographically signed payload transfers. Require Station 2 to validate and bind the measurement against the radiologist session's 'head_digest' before updating state. Reject any state advancement where 'predecessor_head_digest' is null or unpinned, failing closed with an explicit verification error.",
  "confidence": "HIGH"
}
