{
  "finding_id": "FINDING-CASE-4190-A",
  "verdict": "PASS",
  "identified_issues": [],
  "evidence": [
    "Switching Order SO-2026-8812 was submitted at 2026-10-06T15:45:00.000Z and approved by Chief Grid Dispatcher K. Lin at 2026-10-06T15:50:00.000Z with status APPROVED_PRE_AUTHORIZED, prior to physical actuation.",
    "Physical actuation of BKR_512 occurred at 2026-10-06T16:10:02.145Z, well within the pre-authorized window of 16:00:00Z to 17:00:00Z.",
    "Execution completion logging EMS_LOG_9941 was recorded in DISPATCH_EMS at 2026-10-06T16:12:15.000Z, 2 minutes and 13 seconds after breaker opening, satisfying the 15-minute post-execution reporting window mandated by Regional Grid Operating Standard Section 4.2."
  ],
  "recommended_action": "Dismiss the compliance auditor's infraction notice as unfounded. The auditor erroneously conflated the post-execution completion logging requirement with the pre-authorization requirement. Close the audit inquiry with no remedial action required for substation operations.",
  "confidence": "HIGH"
}
